Type,SKU,Name,Published,Is featured?,Visibility in catalog,Short description,Description,Regular price,Sale price,Categories,Tags,Images,Stock,Attribute 1 name,Attribute 1 value(s),Attribute 1 visible,Attribute 2 name,Attribute 2 value(s),Attribute 2 visible
simple,KZ-NK-AF1,Nike Air Force 1 White,1,1,visible,"Sneaker trang co dien, de phoi do va phu hop su dung hang ngay.","Nike Air Force 1 White la mau sneaker co dien phu hop voi nhieu phong cach khac nhau, tu di hoc, di lam den phoi do streetwear cuoi tuan. Phan upper mau trang de phoi, form giay on dinh, de chac va cam giac mang quen thuoc. San pham phu hop voi khach hang can mot doi giay ben, de ve sinh, khong loi mot va co the su dung thuong xuyen. KickZone cung cap day du size pho bien, tu van chon size truoc khi mua va ho tro doi size trong 7 ngay neu san pham con nguyen tem hop.",2800000,2520000,Sneaker,"nike, classic, white",https://images.unsplash.com/photo-1600185365926-3a2ce3cdb9eb,18,Size,"38 | 39 | 40 | 41 | 42 | 43 | 44",1,Color,White,1
simple,KZ-AD-UB22,Adidas Ultra Boost 22,1,1,visible,"Giay running em, thoang khi, phu hop chay nhe va di chuyen ca ngay.","Adidas Ultra Boost 22 duoc chon cho nhom khach hang can mot doi giay running co do em tot va van de phoi voi trang phuc hang ngay. Phan dem Boost mang lai cam giac dan hoi, upper thoang khi giup ban chan thoai mai trong thoi gian dai. Mau giay phu hop voi nguoi di bo nhieu, chay nhe hoac can mot doi giay linh hoat cho lich hoc va lam viec. KickZone tu van size theo chieu dai ban chan va ho tro doi size trong vong 7 ngay.",3200000,2880000,Running,"adidas, boost, running",https://images.unsplash.com/photo-1587563871167-1ee9c731aefb,12,Size,"39 | 40 | 41 | 42 | 43 | 44",1,Color,Black,1
simple,KZ-NB-574,New Balance 574 Grey,1,0,visible,"Lifestyle sneaker mau xam trung tinh, dang retro de mac.","New Balance 574 Grey la lua chon an toan cho nguoi thich phong cach retro, don gian va lich su. Mau xam trung tinh giup doi giay phoi duoc voi quan jeans, kaki, short hoac outfit cong so thoai mai. Form giay on dinh, phan de vua du em cho nhu cau di lai hang ngay. Day la san pham phu hop voi khach hang muon mot doi sneaker ben, khong qua noi bat nhung van co nhan dien thuong hieu ro rang.",2500000,2250000,Lifestyle,"newbalance, casual",https://images.unsplash.com/photo-1539185441755-769473a23570,20,Size,"38 | 39 | 40 | 41 | 42 | 43",1,Color,Grey,1
simple,KZ-PM-RSX,Puma RS-X Reinvention,1,0,visible,"Sneaker chunky phoi mau tre trung, tao diem nhan streetwear.","Puma RS-X Reinvention phu hop voi nguoi thich dang giay chunky va mau sac noi bat. San pham co form day dan, phan de tao cam giac chac chan va thiet ke nhieu lop giup outfit basic tro nen ca tinh hon. Mau giay nay phu hop voi quan jogger, cargo, denim va ao oversize. KickZone khuyen nghi khach hang chon dung size hoac tang nua size neu thich mang rong.",2200000,1980000,Sneaker,"puma, chunky, colorful",https://images.unsplash.com/photo-1556048219-bb6978360b84,9,Size,"39 | 40 | 41 | 42 | 43 | 44",1,Color,Multi,1
simple,KZ-CV-CTAS,Converse Chuck Taylor All Star,1,0,visible,"Giay canvas unisex, nhe, de phoi voi phong cach hoc duong.","Converse Chuck Taylor All Star la mau giay canvas quen thuoc voi thiet ke toi gian, de phoi va phu hop ca nam lan nu. Form giay gon, trong luong nhe, thich hop cho di hoc, di choi va phong cach vintage. Chat lieu canvas can duoc bao quan noi kho thoang va han che ngam nuoc lau. KickZone cung cap nhieu size pho bien va huong dan ve sinh rieng cho chat lieu vai.",1800000,1620000,Classic,"converse, canvas, unisex",https://images.unsplash.com/photo-1622760807800-66cf1460fc4c,25,Size,"36 | 37 | 38 | 39 | 40 | 41 | 42 | 43 | 44",1,Color,Black,1
simple,KZ-VN-OS,Vans Old Skool Black/White,1,0,visible,"Mau skate classic voi side stripe dac trung va de bam tot.","Vans Old Skool Black White la mau giay skate classic co kha nang phoi do rat linh hoat. Phan than giay den trang de mac voi nhieu phong cach, tu casual, streetwear den outfit di hoc. De waffle bam tot, form giay gon va ben khi su dung hang ngay. San pham phu hop voi khach hang can mot doi giay co nhan dien thuong hieu ro, gia hop ly va khong loi mot.",1900000,1710000,Skate,"vans, skate, classic",https://images.unsplash.com/photo-1525966222134-fcfa99b8ae77,16,Size,"38 | 39 | 40 | 41 | 42 | 43 | 44",1,Color,Black/White,1
simple,KZ-NK-AM270,Nike Air Max 270,1,1,visible,"Giay dem Air lon o got, em va hien dai cho daily wear.","Nike Air Max 270 co thiet ke hien dai voi tui Air lon o got, tao cam giac em ro khi di chuyen. Mau giay phu hop voi nguoi thich sneaker nang dong, co the su dung cho di bo, tap nhe va phoi do hang ngay. Phan upper thoang, form om vua phai va de giay noi bat giup san pham tro thanh diem nhan cua outfit. KickZone khuyen nghi thu size truoc neu ban co ban chan be ngang.",3500000,3150000,Running,"nike, airmax, cushion",https://images.unsplash.com/photo-1605408499391-6368c628ef42,11,Size,"39 | 40 | 41 | 42 | 43 | 44",1,Color,White/Red,1
simple,KZ-AD-SS,Adidas Stan Smith White,1,0,visible,"Lifestyle sneaker toi gian, trang xanh, phu hop di hoc va cong so.","Adidas Stan Smith White la mau lifestyle sneaker toi gian lay cam hung tu giay tennis. Tong trang xanh de phoi, phu hop voi quan jeans, chinos va trang phuc lich su hang ngay. Thiet ke gon giup doi giay khong qua the thao nhung van tre trung. San pham phu hop voi khach hang can mot doi giay sach se, de mang, de phoi va co tinh ung dung cao trong nhieu hoan canh.",2400000,2160000,Lifestyle,"adidas, minimalist",https://images.unsplash.com/photo-1608231387042-66d1773070a5,14,Size,"37 | 38 | 39 | 40 | 41 | 42 | 43 | 44",1,Color,White/Green,1
